<?xml version="1.0" encoding="UTF-8" ?>
<!DOCTYPE component PUBLIC "-//Carrot2//DTD Component Dependency Descriptor V1.0//EN" "http://www.cs.put.poznan.pl/dweiss/carrot/component-dependency.dtd" >

<component
    name="carrot2-input-yahooapi"
    description="Carrot2 Input Component using YahooAPI">

    <provides profile="local">
        <files build-path-exclude="true" prefix="tmp/dist">
            <file location="carrot2-input-yahooapi.jar" />
        </files>
        <build>
            <ant file="build.local.xml" target="build"/>
        </build>
		<check-newer>
			<fileset dir="src" />
			<fileset dir="web" />
		</check-newer>
    </provides>

    <provides profile="remote">
        <files build-path-exclude="true" prefix="tmp/dist">
            <file location="carrot2-input-yahooapi.war" />
        </files>
        <build>
            <ant file="build.remote.xml" target="build"/>
        </build>
		<check-newer>
			<fileset dir="src" />
			<fileset dir="web" />
		</check-newer>
    </provides>

    <dependency name="log4j" />

    <dependency name="junit" profile="test" />

    <dependency name="carrot2-util-common" />
    <dependency name="carrot2-local-core" />
    <dependency name="carrot2-license" />
    <dependency name="commons-httpclient" />

    <dependency name="servlets-api"           profile="test" />
    <dependency name="carrot2-util-remote"    profile="test" />

    <dependency name="servlets-api"           profile="remote" nocopy="true" />
	<dependency name="carrot2-util-remote" 	  profile="remote" />
</component>
