<?xml version="1.0" encoding="UTF-8" ?>
<!DOCTYPE component SYSTEM "../../etc/component-dependency.dtd" >

<component
    name="carrot2-input-tree-snippet-miner"
    description="Carrot2 Tree Snippet Miner Input Component">

    <provides>
        <files build-path-exclude="true" prefix="tmp/dist">
            <file location="carrot2-input-tree-snippet-miner.war" />
        </files>
        <build>
            <ant file="build.xml" target="build" />
        </build>
    </provides>

	<!-- Carrot2 components -->
    <dependency name="carrot2-license" />
	<dependency name="carrot2-util-remote" />
	<dependency name="carrot2-util-common" />
	<dependency name="carrot2-util-put" />
	<dependency name="log4j" />
	<dependency name="jdom" />
	<dependency name="gnu-regexp" />

</component>
