<?xml version="1.0" encoding="UTF-8" ?>
<!DOCTYPE component PUBLIC "-//Carrot2//DTD Component Dependency Descriptor V1.0//EN" "http://www.cs.put.poznan.pl/dweiss/carrot/component-dependency.dtd" >

<component
    name="carrot2-util-matrix"
    description="Carrot2 Matrix Routines">
    
    <provides>
        <files build-path-exclude="true" prefix="tmp/dist">
            <file location="carrot2-util-matrix.jar" />
        </files>
        <build>
            <ant file="build.xml" target="build" />
        </build>
    </provides>

    <dependency name="colt" />
    <dependency name="nni" />
    <dependency name="carrot2-util-common" />
    <dependency name="carrot2-license" />
    <dependency name="junit" profile="test" />
    <dependency name="junit-addons" profile="test" />
    
</component>
